{
  "params": {
    "schemaVersion": "0.1.0-q1",
    "topology": "RF",
    "machineType": "PMSM",
    "units": {
      "length": "mm",
      "angle": "deg"
    },
    "rotorTopology": "inner",
    "stator": {
      "innerDiameter": 51.0,
      "outerDiameter": 80.0,
      "stackLength": 25.0,
      "slotCount": 18,
      "slotShape": "straight",
      "toothWidth": 4.5,
      "yokeHeight": 5.0,
      "skewAngle": null
    },
    "rotor": {
      "innerDiameter": 15.0,
      "outerDiameter": 50.0,
      "magnetTopology": "SPM",
      "poleCount": 6
    },
    "airgap": 0.5,
    "axialActiveLength": 25.0
  },
  "meshDescriptor": {
    "schemaVersion": "0.1.0-q1",
    "kind": "radial",
    "units": {
      "length": "mm",
      "angle": "deg"
    },
    "meta": {
      "rotorTopology": "inner",
      "machineType": "PMSM",
      "slotCount": 18,
      "poleCount": 6,
      "airgap": 0.5,
      "magnetThickness": 2.625,
      "magnetThicknessSource": "estimated_from_airgap_rotor",
      "magnetSweepDeg": 42.0,
      "magnetSpanSource": "estimated_pole_pitch_0.7",
      "magnetInnerRadius": 22.375,
      "magnetOuterRadius": 25.0,
      "source": "parametric-rebuild",
      "modelingComplete": false,
      "fidelity": "constructive-descriptor",
      "hudDims": {
        "slotCount": 18,
        "poleCount": 6,
        "airgapMm": 0.5,
        "magnetThicknessMm": 2.625
      }
    },
    "primitives": [
      {
        "type": "ring",
        "name": "stator_yoke",
        "innerRadius": 35.0,
        "outerRadius": 40.0,
        "height": 25.0,
        "z": 0.0,
        "radialSegments": 72,
        "thetaSegments": 72,
        "role": "stator_yoke"
      },
      {
        "type": "sector",
        "name": "stator_tooth_0",
        "innerRadius": 25.5,
        "outerRadius": 35.0,
        "height": 25.0,
        "startAngleDeg": 5.7383304494401575,
        "sweepAngleDeg": 8.523339101119685,
        "z": 0.0,
        "segments": 8,
        "role": "stator_tooth"
      },
      {
        "type": "sector",
        "name": "stator_slot_0",
        "innerRadius": 25.5,
        "outerRadius": 35.0,
        "height": 25.0,
        "startAngleDeg": 14.261669550559843,
        "sweepAngleDeg": 11.476660898880315,
        "z": 0.0,
        "segments": 6,
        "role": "stator_slot"
      },
      {
        "type": "sector",
        "name": "stator_tooth_1",
        "innerRadius": 25.5,
        "outerRadius": 35.0,
        "height": 25.0,
        "startAngleDeg": 25.738330449440156,
        "sweepAngleDeg": 8.523339101119685,
        "z": 0.0,
        "segments": 8,
        "role": "stator_tooth"
      },
      {
        "type": "sector",
        "name": "stator_slot_1",
        "innerRadius": 25.5,
        "outerRadius": 35.0,
        "height": 25.0,
        "startAngleDeg": 34.261669550559844,
        "sweepAngleDeg": 11.476660898880315,
        "z": 0.0,
        "segments": 6,
        "role": "stator_slot"
      },
      {
        "type": "sector",
        "name": "stator_tooth_2",
        "innerRadius": 25.5,
        "outerRadius": 35.0,
        "height": 25.0,
        "startAngleDeg": 45.738330449440156,
        "sweepAngleDeg": 8.523339101119685,
        "z": 0.0,
        "segments": 8,
        "role": "stator_tooth"
      },
      {
        "type": "sector",
        "name": "stator_slot_2",
        "innerRadius": 25.5,
        "outerRadius": 35.0,
        "height": 25.0,
        "startAngleDeg": 54.261669550559844,
        "sweepAngleDeg": 11.476660898880315,
        "z": 0.0,
        "segments": 6,
        "role": "stator_slot"
      },
      {
        "type": "sector",
        "name": "stator_tooth_3",
        "innerRadius": 25.5,
        "outerRadius": 35.0,
        "height": 25.0,
        "startAngleDeg": 65.73833044944016,
        "sweepAngleDeg": 8.523339101119685,
        "z": 0.0,
        "segments": 8,
        "role": "stator_tooth"
      },
      {
        "type": "sector",
        "name": "stator_slot_3",
        "innerRadius": 25.5,
        "outerRadius": 35.0,
        "height": 25.0,
        "startAngleDeg": 74.26166955055984,
        "sweepAngleDeg": 11.476660898880315,
        "z": 0.0,
        "segments": 6,
        "role": "stator_slot"
      },
      {
        "type": "sector",
        "name": "stator_tooth_4",
        "innerRadius": 25.5,
        "outerRadius": 35.0,
        "height": 25.0,
        "startAngleDeg": 85.73833044944016,
        "sweepAngleDeg": 8.523339101119685,
        "z": 0.0,
        "segments": 8,
        "role": "stator_tooth"
      },
      {
        "type": "sector",
        "name": "stator_slot_4",
        "innerRadius": 25.5,
        "outerRadius": 35.0,
        "height": 25.0,
        "startAngleDeg": 94.26166955055984,
        "sweepAngleDeg": 11.476660898880315,
        "z": 0.0,
        "segments": 6,
        "role": "stator_slot"
      },
      {
        "type": "sector",
        "name": "stator_tooth_5",
        "innerRadius": 25.5,
        "outerRadius": 35.0,
        "height": 25.0,
        "startAngleDeg": 105.73833044944016,
        "sweepAngleDeg": 8.523339101119685,
        "z": 0.0,
        "segments": 8,
        "role": "stator_tooth"
      },
      {
        "type": "sector",
        "name": "stator_slot_5",
        "innerRadius": 25.5,
        "outerRadius": 35.0,
        "height": 25.0,
        "startAngleDeg": 114.26166955055984,
        "sweepAngleDeg": 11.476660898880315,
        "z": 0.0,
        "segments": 6,
        "role": "stator_slot"
      },
      {
        "type": "sector",
        "name": "stator_tooth_6",
        "innerRadius": 25.5,
        "outerRadius": 35.0,
        "height": 25.0,
        "startAngleDeg": 125.73833044944016,
        "sweepAngleDeg": 8.523339101119685,
        "z": 0.0,
        "segments": 8,
        "role": "stator_tooth"
      },
      {
        "type": "sector",
        "name": "stator_slot_6",
        "innerRadius": 25.5,
        "outerRadius": 35.0,
        "height": 25.0,
        "startAngleDeg": 134.26166955055984,
        "sweepAngleDeg": 11.476660898880315,
        "z": 0.0,
        "segments": 6,
        "role": "stator_slot"
      },
      {
        "type": "sector",
        "name": "stator_tooth_7",
        "innerRadius": 25.5,
        "outerRadius": 35.0,
        "height": 25.0,
        "startAngleDeg": 145.73833044944016,
        "sweepAngleDeg": 8.523339101119685,
        "z": 0.0,
        "segments": 8,
        "role": "stator_tooth"
      },
      {
        "type": "sector",
        "name": "stator_slot_7",
        "innerRadius": 25.5,
        "outerRadius": 35.0,
        "height": 25.0,
        "startAngleDeg": 154.26166955055984,
        "sweepAngleDeg": 11.476660898880315,
        "z": 0.0,
        "segments": 6,
        "role": "stator_slot"
      },
      {
        "type": "sector",
        "name": "stator_tooth_8",
        "innerRadius": 25.5,
        "outerRadius": 35.0,
        "height": 25.0,
        "startAngleDeg": 165.73833044944016,
        "sweepAngleDeg": 8.523339101119685,
        "z": 0.0,
        "segments": 8,
        "role": "stator_tooth"
      },
      {
        "type": "sector",
        "name": "stator_slot_8",
        "innerRadius": 25.5,
        "outerRadius": 35.0,
        "height": 25.0,
        "startAngleDeg": 174.26166955055984,
        "sweepAngleDeg": 11.476660898880315,
        "z": 0.0,
        "segments": 6,
        "role": "stator_slot"
      },
      {
        "type": "sector",
        "name": "stator_tooth_9",
        "innerRadius": 25.5,
        "outerRadius": 35.0,
        "height": 25.0,
        "startAngleDeg": 185.73833044944016,
        "sweepAngleDeg": 8.523339101119685,
        "z": 0.0,
        "segments": 8,
        "role": "stator_tooth"
      },
      {
        "type": "sector",
        "name": "stator_slot_9",
        "innerRadius": 25.5,
        "outerRadius": 35.0,
        "height": 25.0,
        "startAngleDeg": 194.26166955055984,
        "sweepAngleDeg": 11.476660898880315,
        "z": 0.0,
        "segments": 6,
        "role": "stator_slot"
      },
      {
        "type": "sector",
        "name": "stator_tooth_10",
        "innerRadius": 25.5,
        "outerRadius": 35.0,
        "height": 25.0,
        "startAngleDeg": 205.73833044944016,
        "sweepAngleDeg": 8.523339101119685,
        "z": 0.0,
        "segments": 8,
        "role": "stator_tooth"
      },
      {
        "type": "sector",
        "name": "stator_slot_10",
        "innerRadius": 25.5,
        "outerRadius": 35.0,
        "height": 25.0,
        "startAngleDeg": 214.26166955055984,
        "sweepAngleDeg": 11.476660898880315,
        "z": 0.0,
        "segments": 6,
        "role": "stator_slot"
      },
      {
        "type": "sector",
        "name": "stator_tooth_11",
        "innerRadius": 25.5,
        "outerRadius": 35.0,
        "height": 25.0,
        "startAngleDeg": 225.73833044944016,
        "sweepAngleDeg": 8.523339101119685,
        "z": 0.0,
        "segments": 8,
        "role": "stator_tooth"
      },
      {
        "type": "sector",
        "name": "stator_slot_11",
        "innerRadius": 25.5,
        "outerRadius": 35.0,
        "height": 25.0,
        "startAngleDeg": 234.26166955055984,
        "sweepAngleDeg": 11.476660898880315,
        "z": 0.0,
        "segments": 6,
        "role": "stator_slot"
      },
      {
        "type": "sector",
        "name": "stator_tooth_12",
        "innerRadius": 25.5,
        "outerRadius": 35.0,
        "height": 25.0,
        "startAngleDeg": 245.73833044944016,
        "sweepAngleDeg": 8.523339101119685,
        "z": 0.0,
        "segments": 8,
        "role": "stator_tooth"
      },
      {
        "type": "sector",
        "name": "stator_slot_12",
        "innerRadius": 25.5,
        "outerRadius": 35.0,
        "height": 25.0,
        "startAngleDeg": 254.26166955055984,
        "sweepAngleDeg": 11.476660898880315,
        "z": 0.0,
        "segments": 6,
        "role": "stator_slot"
      },